ingredients_id;ingredients_name;ingredients_description;ingredients_found;ingredients_rarity
1;"Castele Copper";"Common Castele Copper ore.";"East Castele, East Grassy Plains";0
2;"Plains Iron";"Used to make many weapons and armor.";"East Grassy Plains, West Grassy Plains";1
3;"Port Puerto Silver";"Port Puerto abounds with this ore.";"Tortuga Archipelago";2
4;"Al Maajik Gold";"Precious ore mined in the Al Maajik area.";"Al Maajik, Aridian Desert";3
5;"Platinum Ore";"Rare metal found on the top of Mount Snowpeak";"Mount Snowpeak Summit";4
